{
  "telemetry_schema": 3,
  "process_instance_id": "019d1111-5c11-7cb2-9b64-9cf25ab8cd10",
  "sequence": 4812,
  "observed_at_unix_ms": 1800000000000,
  "uptime_seconds": 86400,
  "version": "1.1.16-patch-v1.3.2",
  "relay_probe_protocol": 1,
  "relay_load_protocol": 1,
  "fast_media": {
    "protocol": 1,
    "renewal_protocol": 1,
    "enabled": true,
    "healthy": true,
    "udp_port": 22119,
    "active_allocations": 12,
    "active_streams": 10,
    "hello_accepted": 19200,
    "cookie_rejected": 3,
    "bind_succeeded": 2800,
    "bind_rejected": 5,
    "grant_rejected": 2,
    "role_mismatch": 1,
    "session_mismatch": 0,
    "allocation_mismatch": 1,
    "rebinds": 24,
    "forwarded_packets": 250000,
    "forwarded_bytes": 220000000,
    "dropped_packets": 42,
    "rate_limited": 7,
    "replay_rejected": 5,
    "expired_allocations": 12,
    "listener_failures": 0,
    "replay_window_packets": 2048,
    "maximum_forward_sequence_jump": 1048576,
    "max_session_seconds": 43200,
    "transition_seconds": 15,
    "post_expiry_recovery_seconds": 30,
    "per_ip_bytes_per_second": 33554432,
    "global_bytes_per_second": 536870912,
    "reserved_bytes_per_second": 14500000,
    "peak_per_ip_reserved_bytes_per_second": 7250000,
    "active_role_reservations": 20,
    "renewal_grants_accepted": 840,
    "renewal_grants_replayed": 9,
    "renewal_rejected_invalid": 1,
    "renewal_rejected_binding": 2,
    "renewal_rejected_sequence": 1,
    "renewal_rejected_expired": 1,
    "post_expiry_rebinds": 3,
    "replay_rejected_duplicate": 2,
    "replay_rejected_too_old": 2,
    "replay_rejected_jump": 1,
    "admission_accepted": 24,
    "admission_rejected_allocation": 0,
    "admission_rejected_per_ip": 2,
    "admission_rejected_global": 1,
    "minimum_remaining_ttl_seconds": 41,
    "expiring_within_30_seconds": 2
  },
  "load_basis_points": 2375,
  "active_sessions": 19,
  "pending_pairs": 3,
  "capacity_sessions": 200,
  "bandwidth_bps": 123456700,
  "bandwidth_ema_alpha_basis_points": 2500,
  "capacity_bandwidth_bps": 1000000000,
  "draining": false,
  "admission_open": true,
  "admission_rejections": 4,
  "probe_malformed": 2,
  "probe_unsupported": 1,
  "probe_rate_limited": 8,
  "probe_successful": 19200,
  "telemetry_auth_failures": 0
}
